{
  "$schema": "https://json-schema.org/draft/2020-12/schema",
  "$id": "https://sqlobserver.invalid/schemas/m12-observability-contract.v1.schema.json",
  "title": "SqlObserver M12 observability contract",
  "type": "object",
  "additionalProperties": false,
  "required": ["$schema", "schemaVersion", "contractId", "producerId", "artifactKind", "serviceNames", "activitySourceName", "meterName", "readiness", "telemetry", "cases", "assetPins"],
  "properties": {
    "$schema": { "const": "m12-observability-contract.v1.schema.json" },
    "schemaVersion": { "const": 1 },
    "contractId": { "const": "sqlobserver-m12-observability" },
    "producerId": { "const": "m12-observability-harness" },
    "artifactKind": { "const": "observability-evidence" },
    "serviceNames": { "const": ["SqlObserver.Server", "SqlObserver.Collector"] },
    "activitySourceName": { "const": "SqlObserver.Observability" },
    "meterName": { "const": "SqlObserver.Observability" },
    "readiness": { "type": "object", "additionalProperties": false, "required": ["operation", "repository", "majorVersion", "failClosed", "maximumTimeoutSeconds", "allowedAttributes"], "properties": { "operation": { "const": "repository.readiness" }, "repository": { "const": "PostgreSQL" }, "majorVersion": { "const": 18 }, "failClosed": { "const": true }, "maximumTimeoutSeconds": { "const": 5 }, "allowedAttributes": { "type": "array", "minItems": 1, "uniqueItems": true, "items": { "type": "string" } } } },
    "telemetry": { "type": "object", "additionalProperties": false, "required": ["maximumAttributes", "maximumAttributeValueLength", "forbiddenAttributes", "endpointPolicy"], "properties": { "maximumAttributes": { "const": 12 }, "maximumAttributeValueLength": { "const": 64 }, "forbiddenAttributes": { "type": "array", "minItems": 1, "uniqueItems": true, "items": { "type": "string" } }, "endpointPolicy": { "const": "https-remote-or-loopback-http-contract-testing" } } },
    "cases": { "const": [ { "caseId": "m12-readiness-observability", "testName": "LiveReleaseRepositoryReadinessIsBoundedFailClosedAndOtelVisible", "facts": { "readiness": true, "otel": true } }, { "caseId": "m12-telemetry-observability", "testName": "LiveReleaseCollectorTelemetryIsBoundedAndSensitiveDataFree", "facts": { "telemetry": true, "otel": true } } ] },
    "assetPins": { "type": "object", "additionalProperties": false, "required": ["Directory.Packages.props", "src/SqlObserver.Observability/SqlObserver.Observability.csproj", "src/SqlObserver.Observability/ObservabilityContracts.cs", "src/SqlObserver.Observability/packages.lock.json", "src/SqlObserver.Server/Program.cs", "src/SqlObserver.Server/ServerServiceRegistration.cs", "src/SqlObserver.Server/SqlObserver.Server.csproj", "src/SqlObserver.Server/packages.lock.json", "src/SqlObserver.Collector/Program.cs", "src/SqlObserver.Collector/CollectorServiceRegistration.cs", "src/SqlObserver.Collector/SqlObserver.Collector.csproj", "src/SqlObserver.Collector/packages.lock.json", "src/SqlObserver.Collectors/CollectorExecutionEngine.cs", "src/SqlObserver.Collectors/CollectorScheduler.cs", "src/SqlObserver.Infrastructure.PostgreSql/PostgreSqlCollectorDataPlane.cs", "src/SqlObserver.Infrastructure.PostgreSql/PostgreSqlTargetControlPlane.cs", "src/SqlObserver.Infrastructure.PostgreSql/PostgreSqlCompatibilityPort.cs", "src/SqlObserver.Infrastructure.PostgreSql/packages.lock.json", "tests/SqlObserver.IntegrationTests.PostgreSql/SqlObserver.IntegrationTests.PostgreSql.csproj", "tests/SqlObserver.IntegrationTests.PostgreSql/packages.lock.json", "tests/SqlObserver.IntegrationTests.PostgreSql/M12ObservabilityCertificationTests.cs", "tests/SqlObserver.UnitTests/SqlObserver.UnitTests.csproj", "tests/SqlObserver.UnitTests/packages.lock.json", "tests/SqlObserver.UnitTests/M12ObservabilityContractTests.cs", "release/certification/m12-certification-matrix.v1.json"], "properties": { "Directory.Packages.props": { "type": "string", "pattern": "^[0-9a-f]{64}$" }, "src/SqlObserver.Observability/SqlObserver.Observability.csproj": { "type": "string", "pattern": "^[0-9a-f]{64}$" }, "src/SqlObserver.Observability/ObservabilityContracts.cs": { "type": "string", "pattern": "^[0-9a-f]{64}$" }, "src/SqlObserver.Observability/packages.lock.json": { "type": "string", "pattern": "^[0-9a-f]{64}$" }, "src/SqlObserver.Server/Program.cs": { "type": "string", "pattern": "^[0-9a-f]{64}$" }, "src/SqlObserver.Server/ServerServiceRegistration.cs": { "type": "string", "pattern": "^[0-9a-f]{64}$" }, "src/SqlObserver.Server/SqlObserver.Server.csproj": { "type": "string", "pattern": "^[0-9a-f]{64}$" }, "src/SqlObserver.Server/packages.lock.json": { "type": "string", "pattern": "^[0-9a-f]{64}$" }, "src/SqlObserver.Collector/Program.cs": { "type": "string", "pattern": "^[0-9a-f]{64}$" }, "src/SqlObserver.Collector/CollectorServiceRegistration.cs": { "type": "string", "pattern": "^[0-9a-f]{64}$" }, "src/SqlObserver.Collector/SqlObserver.Collector.csproj": { "type": "string", "pattern": "^[0-9a-f]{64}$" }, "src/SqlObserver.Collector/packages.lock.json": { "type": "string", "pattern": "^[0-9a-f]{64}$" }, "src/SqlObserver.Collectors/CollectorExecutionEngine.cs": { "type": "string", "pattern": "^[0-9a-f]{64}$" }, "src/SqlObserver.Collectors/CollectorScheduler.cs": { "type": "string", "pattern": "^[0-9a-f]{64}$" }, "src/SqlObserver.Infrastructure.PostgreSql/PostgreSqlCollectorDataPlane.cs": { "type": "string", "pattern": "^[0-9a-f]{64}$" }, "src/SqlObserver.Infrastructure.PostgreSql/PostgreSqlTargetControlPlane.cs": { "type": "string", "pattern": "^[0-9a-f]{64}$" }, "src/SqlObserver.Infrastructure.PostgreSql/PostgreSqlCompatibilityPort.cs": { "type": "string", "pattern": "^[0-9a-f]{64}$" }, "src/SqlObserver.Infrastructure.PostgreSql/packages.lock.json": { "type": "string", "pattern": "^[0-9a-f]{64}$" }, "tests/SqlObserver.IntegrationTests.PostgreSql/SqlObserver.IntegrationTests.PostgreSql.csproj": { "type": "string", "pattern": "^[0-9a-f]{64}$" }, "tests/SqlObserver.IntegrationTests.PostgreSql/packages.lock.json": { "type": "string", "pattern": "^[0-9a-f]{64}$" }, "tests/SqlObserver.IntegrationTests.PostgreSql/M12ObservabilityCertificationTests.cs": { "type": "string", "pattern": "^[0-9a-f]{64}$" }, "tests/SqlObserver.UnitTests/SqlObserver.UnitTests.csproj": { "type": "string", "pattern": "^[0-9a-f]{64}$" }, "tests/SqlObserver.UnitTests/packages.lock.json": { "type": "string", "pattern": "^[0-9a-f]{64}$" }, "tests/SqlObserver.UnitTests/M12ObservabilityContractTests.cs": { "type": "string", "pattern": "^[0-9a-f]{64}$" }, "release/certification/m12-certification-matrix.v1.json": { "type": "string", "pattern": "^[0-9a-f]{64}$" } } }
  }
}
