{
  "$schema": "m12-observability-contract.v1.schema.json",
  "schemaVersion": 1,
  "contractId": "sqlobserver-m12-observability",
  "producerId": "m12-observability-harness",
  "artifactKind": "observability-evidence",
  "serviceNames": ["SqlObserver.Server", "SqlObserver.Collector"],
  "activitySourceName": "SqlObserver.Observability",
  "meterName": "SqlObserver.Observability",
  "readiness": {
    "operation": "repository.readiness",
    "repository": "PostgreSQL",
    "majorVersion": 18,
    "failClosed": true,
    "maximumTimeoutSeconds": 5,
    "allowedAttributes": ["db.system", "db.operation.name", "sqlobserver.repository.ready", "sqlobserver.repository.postgresql.major", "sqlobserver.repository.compatibility"]
  },
  "telemetry": {
    "maximumAttributes": 12,
    "maximumAttributeValueLength": 64,
    "forbiddenAttributes": ["sqlobserver.target.id", "db.connection_string", "db.statement", "enduser.id"],
    "endpointPolicy": "https-remote-or-loopback-http-contract-testing"
  },
  "cases": [
    { "caseId": "m12-readiness-observability", "testName": "LiveReleaseRepositoryReadinessIsBoundedFailClosedAndOtelVisible", "facts": { "readiness": true, "otel": true } },
    { "caseId": "m12-telemetry-observability", "testName": "LiveReleaseCollectorTelemetryIsBoundedAndSensitiveDataFree", "facts": { "telemetry": true, "otel": true } }
  ],
  "assetPins": {
    "Directory.Packages.props": "5699d9704833cac0565ca7f91db7545f85594859dad1bc2c7f263361a9032280",
    "src/SqlObserver.Observability/SqlObserver.Observability.csproj": "60576c36aab91800264f4e35c58943fded212a53c029a90171a87e897f0828c5",
    "src/SqlObserver.Observability/ObservabilityContracts.cs": "7113bcc81e331cf73417d4538ac713e03b2cee8e23d2294edf123e945f544a21",
    "src/SqlObserver.Observability/packages.lock.json": "9921a06f61fbd419a030273ecc8a58e96cffaf02bcf95e1c07088e62098b2468",
    "src/SqlObserver.Server/Program.cs": "7e235c856f25a63c6e962cec440e3e4967bdb4bd5238dabc81d4c06b07d2aedb",
    "src/SqlObserver.Server/ServerServiceRegistration.cs": "6486f74a42216f3e8686019afe3a74f3cf991a8af8be9c125c955590560e1939",
    "src/SqlObserver.Server/SqlObserver.Server.csproj": "168a9680121046f74bc64e2baa9e4313ba4c8279bf3bde89762da30d6385be93",
    "src/SqlObserver.Server/packages.lock.json": "f398f1863d3a8164d26059be0b6e82b3c48ebe6f856d675d6d20034452e512fd",
    "src/SqlObserver.Collector/Program.cs": "a267f4428236dc0755ce31dac75576175c0190fe685865fd2cbe468726a76090",
    "src/SqlObserver.Collector/CollectorServiceRegistration.cs": "f765c1781d3e76a5a89f1af13972d696ad4f6ec6f35d8b438588a0d8763c2888",
    "src/SqlObserver.Collector/SqlObserver.Collector.csproj": "87c4794857248be281692e58b75a402e7b342e341812c2f1d28a0e02f11d1f6b",
    "src/SqlObserver.Collector/packages.lock.json": "be84e9538e32ca205ecb96713a33d1fccbe8fbab5c47f514e33c847c4e1f22bf",
    "src/SqlObserver.Collectors/CollectorExecutionEngine.cs": "838789741108903bc74742aa8fa423bc34304d0de3b17949c8e6447d479e9883",
    "src/SqlObserver.Collectors/CollectorScheduler.cs": "0892fb072a7cdd85f38f2724795890547bcbaa72ea385dd220f87cb16eba1fce",
    "src/SqlObserver.Infrastructure.PostgreSql/PostgreSqlCollectorDataPlane.cs": "1494872b04ffd2788856b5ba389ed20a3d0e83b8201bd474168fc49abb71a768",
    "src/SqlObserver.Infrastructure.PostgreSql/PostgreSqlTargetControlPlane.cs": "503a197c308bfb5a65b4e9e4ec996ab7d5729a07ca5a86629f1e1c0540f3814e",
    "src/SqlObserver.Infrastructure.PostgreSql/PostgreSqlCompatibilityPort.cs": "41ef7ad9222fc32fde5a637fe356e5f17961766762f1fd7bcfdec9e12a0e98be",
    "src/SqlObserver.Infrastructure.PostgreSql/packages.lock.json": "8e59cdd654f5c8f859219cb3c27a94915981e6dec3dec2f6048af724e22de3ec",
    "tests/SqlObserver.IntegrationTests.PostgreSql/SqlObserver.IntegrationTests.PostgreSql.csproj": "2638f3ad2478f664acba5af405d2b0effb1af3b9d22a79a710cc9a2bc687592e",
    "tests/SqlObserver.IntegrationTests.PostgreSql/packages.lock.json": "ee6fe6dc91f4e777dfa0f14c82cd97fc0ad39b01b367269c46e8ad9c7a133de1",
    "tests/SqlObserver.IntegrationTests.PostgreSql/M12ObservabilityCertificationTests.cs": "a0c43cf977cd867df8ca68fd2883249f59b18e1f21e7a0ab63af43f9d3e3fe3a",
    "tests/SqlObserver.UnitTests/SqlObserver.UnitTests.csproj": "6f9c982af8bb9d2cb3613c8725a87a6d66b4fe0d3d22dc2bf117c02022111ebe",
    "tests/SqlObserver.UnitTests/packages.lock.json": "2744738e0fdd11a85b738c0f005003e0aeecdb2ffe11f1e41364fda1e82410b5",
    "tests/SqlObserver.UnitTests/M12ObservabilityContractTests.cs": "abe0e1230b848f22f534020d8795ac41771bbbcc63d9fdf686d67b979502dd5d",
    "release/certification/m12-certification-matrix.v1.json": "8b87625c2a56ea07b1dfe826201557e54891341803a75f2a77d2296509f07aac"
  }
}
